Imagen;Nombre;Precio;Stock;Categoría;Material;Destacado;Estado;Descripción
d1.jpg;Dije Luna Mística;89.90;25;Dijes;plata;destacado;activo;Dije inspirado en la luna, con acabado brillante y estilo minimalista.
b2.jpg;Broche Hoja Dorada;120.00;10;Broches;oro;regular;activo;Broche en forma de hoja, elegante y perfecto para ocasiones formales.
a3.jpg;Aros Eclipse Minimal;75.50;40;Aros;plata;destacado;inactivo;Aros modernos con diseño de eclipse, ligeros y versátiles.
c4.jpg;Cadena Sol Brillante;150.00;18;Cadenas;oro;destacado;activo;Cadena fina con dije de sol, ideal para uso diario o eventos.
an5.jpg;Anillo Aurora Boreal;99.00;30;Anillos;plata;regular;activo;Anillo elegante con reflejos tornasolados inspirados en la aurora boreal.
